{"authorizationReference":"P3_00:GATE-051","counts":{"consumerCalls":1,"databaseDeleteStarted":1,"databaseDeleteTerminal":1,"databaseInsertStarted":1,"databaseInsertTerminal":1,"databaseSelectStarted":3,"databaseSelectTerminal":3,"deleted":1,"employeeEndpointCalls":0,"inserted":1,"modelCalls":0,"preexisting":0,"remaining":0,"resumeCount":0,"retryCount":0,"verified":1},"fieldNames":["idCardNo","chineseName","position","workBaseSi"],"gateId":"GATE-051","lifecycleSha256":"4d5ab81e68d24ac76a7c1d6f7b1a57204b7cb81c99f40f93afe444f4077f5b6c","manifestSha256":"e0c74e5a21d4b80c292cf20266227f7c8f1a11037d1816a6513f6de604e98b11","preparationWorkPackageId":"WP-EMP-EGRESS-TEST-DATA-CANDIDATE-01-PREP","reason":"none","runId":"employee-synthetic-fixture-v1-20260814-candidate-01","safety":{"existingRowsModified":0,"fieldValuesPersisted":false,"fixtureFingerprintPersisted":false,"identifierPersisted":false,"jwtRead":false,"llmApiKeyRead":false,"logLeakCount":0,"modelOutbound":false,"nonRealIdentifier":true,"publicApiCalls":0,"rawLogsDeleted":true,"synthetic":true},"schemaVersion":1,"sourceHistory":[{"kind":"fixture_contract","path":"agent-runtime/tests/integration/adapters/employee/employee_test_data_fixture.py","sha256":"d0b23b75edb600d6aba2e143305a3492c5f263e9d5ce58de55c138c082aa1148"},{"kind":"fixture_schema","path":"agent-runtime/tests/integration/adapters/employee/evidence/employee-test-data-fixture-v1.schema.json","sha256":"93db9b28e38dc77b6568e28e3e3878a021164c6e187ed5e7a7244336005f5f31"},{"kind":"metadata_manifest","path":"agent-runtime/tests/integration/adapters/employee/evidence/employee-fixture-metadata-diagnostic-v2-20260814-candidate-02.manifest.json","sha256":"ce3dcd481352bbb59be01a2d3b975dfd1b9f35ae1479dd24d7408f11be7af6b7"},{"kind":"metadata_authorization","path":"agent-runtime/tests/integration/adapters/employee/evidence/employee-fixture-metadata-diagnostic-v2-20260814-candidate-02.authorization.json","sha256":"532353a032835c7f9eb4e5d8548061f22f45b16f42525d79e635131f5e0a2fb4"},{"kind":"metadata_lifecycle","path":"agent-runtime/tests/integration/adapters/employee/evidence/employee-fixture-metadata-diagnostic-v2-20260814-candidate-02.lifecycle.jsonl","sha256":"affbd35987e4caaa4950888eaed80cf12e695470b1703735716f2dd54d52a105"},{"kind":"metadata_result","path":"agent-runtime/tests/integration/adapters/employee/evidence/employee-fixture-metadata-diagnostic-v2-20260814-candidate-02.result.json","sha256":"9973863d43112a8142bf54eaa1ea18905112d8ca802a24dda7eed5599ab7cd51"}],"status":"passed","workPackageId":"WP-EMP-EGRESS-TEST-DATA-CANDIDATE-01"}
